{
  "record_version": "0.1.0",
  "contract_revision": "evidence.query@0.1.0",
  "read_model_revision": "1.0.0",
  "observation_profile": "1.0.0",
  "status": "FROZEN",
  "published": true,
  "conformance_claim": "VALIDATOR_ONLY",
  "schema_only_conformance": false,
  "semantic": {
    "path": "docs/contracts/evidence-query/evidence-query.md",
    "sha256": "ce13b76cb3c2737e8243c97de880574060a61c05a6a7a67182a2804c04a2a8ef"
  },
  "translation": {
    "path": "docs/contracts/evidence-query/evidence-query.zh-CN.md",
    "sha256": "d68b9f250bd608f0c6d46ace53bfa9f99241fe957f0184d320ecbceadd44ed3b"
  },
  "candidate_publication": {
    "repository": "firestige/system-contracts",
    "tag": "evidence-query-0.1.0-rc.1",
    "url": "https://github.com/firestige/system-contracts/releases/tag/evidence-query-0.1.0-rc.1",
    "target_commit": "dc8a50e92eebfc35bd706579ff2bf5e9beb57782",
    "release_metadata_sha256": "f869e51c3974f038c1f51c4c98e2110cfa90c97ed74e89fc837f052bc7ac41eb",
    "publication_candidate_sha256": "97c3e158c18cd7e92da949d82a17b71c5e4bf08d081fef6e5f4b6dcb9c00c6a7",
    "qualification_sha256": "bda43993fdc5197a3911e159a4ea47ac5020c1cb1ede095838519559a266cadc"
  },
  "machine_candidate": {
    "content_revision": "sha256:6d37245fbac11dde2967a7775efb541e00fb4c8b00c80011b91aef007346cfa1",
    "artifact_count": 35
  },
  "legacy_isolation": "NOT_APPLICABLE_FIRST_RELEASE",
  "content_revision": "sha256:4e904c982504c8c23302c30b1d4f8fcdb9f42693b9bcbafb3c865865eba159d0",
  "artifacts": [
    {
      "path": "README.md",
      "sha256": "ce1822f6ddbe0a40b8304d482c5172292c1af80b5cc905e902067d97532aa6bf"
    },
    {
      "path": "README.zh-CN.md",
      "sha256": "729bf67b276915f6142f0c6f87256a3b206aa3cdb23f6a2c13f44b05a908dcc1"
    },
    {
      "path": "VERSION_POLICY.md",
      "sha256": "95a51d4ca0da8f9510fa64a49edaa180718ab3d4d9a6a9167b30e37063c28f0c"
    },
    {
      "path": "examples/expiry-batch-1.0.0.json",
      "sha256": "e69d00cd6377e37b4e09a033ca818291ca7ae51e1aec65173f0b456a2217f323"
    },
    {
      "path": "examples/expiry-record-1.0.0.json",
      "sha256": "f52f6e27c3119152850a8e2d7832723d8b36d4ac6097df7d55ba90bc7b55a71b"
    },
    {
      "path": "examples/facts-response-0.1.0.json",
      "sha256": "bd5ab9e1dbdfa8eb70d7bc3e2e9d6294a418e587264a1c7fc38fd6274c14a94c"
    },
    {
      "path": "examples/traces-response-0.1.0.json",
      "sha256": "0b114f2611f9fc0e15a3baab2ba48fcfc1e6e254cab595d44b926705e6561da9"
    },
    {
      "path": "fixtures/negative/conflicting-link-metadata.json",
      "sha256": "25e427c3ac958b8b27c4ef92c43835213d7a7410f8b7d2ad3544546cddccf1be"
    },
    {
      "path": "fixtures/negative/expired-relationship-retained.json",
      "sha256": "1de3075fbd80485787d8e84b372e40b37c1ed025dd1fcf529bb212fced2c1941"
    },
    {
      "path": "fixtures/negative/expiry-compatibility-order.json",
      "sha256": "82c1934672a5ae13a62bbedf7402e332c47cc682d24cd2f2d08f8a7938794f7f"
    },
    {
      "path": "fixtures/negative/factual-owner-shape.json",
      "sha256": "29c023ff90f5ec7b819a5d04b1304c16b03039bc4897646c0c3dd69fec72ca84"
    },
    {
      "path": "fixtures/negative/invalid-accept-q.json",
      "sha256": "8e5e7aca9be7b7e1697777320b304ac436a92c4909f12ce83605ebf7ccd404fa"
    },
    {
      "path": "fixtures/negative/raw-owner-shape.json",
      "sha256": "b0a3ff6c8f1e4c676e38b1631e11577da5dddf39979d180ed912ecd1c3003ebf"
    },
    {
      "path": "fixtures/negative/repeated-filter.json",
      "sha256": "a9e885b8936d3ba7b5bb324384f30608c25de70631801532df87a011b020d926"
    },
    {
      "path": "fixtures/positive/batch-digest.json",
      "sha256": "82fd63948a0f1cdb512be4cc40327747b7f78e72cc7958f77b3f6bdd3dd18a4a"
    },
    {
      "path": "fixtures/positive/expiry-result.json",
      "sha256": "195a21284dcfbbce39d0316259d7cbce75831e754aedf192af7bbc696cf98f07"
    },
    {
      "path": "fixtures/positive/facts-request.json",
      "sha256": "e34942168dba3e1d56768d8b929de9c846979da1fb7a4ba590b9fdcf21bdd138"
    },
    {
      "path": "fixtures/positive/manifest-binding.json",
      "sha256": "9becc1a6e366b91397b2ea28f36515128f93b304d90d3af16c05ecedb88ed257"
    },
    {
      "path": "fixtures/positive/trace-identities.json",
      "sha256": "2c70b26650fb4b1369afe751b1b9e37360b429716393f1cf85791952073734d9"
    },
    {
      "path": "fixtures/recovery/batch-selection.json",
      "sha256": "248d826c30958729963241e4c3ebbe0e0425ebd3c9f59b8c3ddbb19428197e5e"
    },
    {
      "path": "fixtures/recovery/cursor-expired.json",
      "sha256": "c5cfa89a0ead19ad3fae9354300932f2a79f4168f4387c14fc522a18fb0abc8d"
    },
    {
      "path": "fixtures/recovery/duplicate-link.json",
      "sha256": "dcfc6e4d0d10113afee6ea5e38fb6930a3cf4162b459f4d1cbdb8e0ee5c4fe1e"
    },
    {
      "path": "fixtures/recovery/restart-lost-cursor.json",
      "sha256": "909ff52330a264f3747b05ad9fdbd341f93bf04ab069a979bd70970fd445b0fb"
    },
    {
      "path": "fixtures/recovery/same-snapshot-summaries.json",
      "sha256": "dfdd0ceb4dbeb5f443a44450462d5db481ddabdbdd1724410a43d0e84eabbc87"
    },
    {
      "path": "package-lock.json",
      "sha256": "cd20be9d05559e0e7738e4426be88149190aada4c7a631b941c3411b1937dfc9"
    },
    {
      "path": "package.json",
      "sha256": "0e3ddbe370e992f7f3ccce37c3012675f13107146aa2a3e71a4e56e14935849b"
    },
    {
      "path": "publication/publication-candidate-0.1.0.json",
      "sha256": "97c3e158c18cd7e92da949d82a17b71c5e4bf08d081fef6e5f4b6dcb9c00c6a7"
    },
    {
      "path": "registries/evidence-query-0.1.0.json",
      "sha256": "ae8594f47f72a46c28245365f1dfd2b60fe0b95a293ac96cdecee5b7f4c95326"
    },
    {
      "path": "schemas/evidence-query-internal-1.0.0.schema.json",
      "sha256": "191a06f81f8ae8254e9f6d38c59494a4270b81b8e67bcc7458873662d1b6e59a"
    },
    {
      "path": "schemas/evidence-query-response-0.1.0.schema.json",
      "sha256": "98438198f6f863d1168c3f552f8f7fdfcb613c132d2c569f8ceaae2eb7876102"
    },
    {
      "path": "schemas/fixture-case-0.1.0.schema.json",
      "sha256": "61f0aef90b13cd639e5504dd12a4f1e9f9ea6869c6122da1671918985838e7e2"
    },
    {
      "path": "schemas/publication-candidate-0.1.0.schema.json",
      "sha256": "ba0f0fa14afbcf135d0ec44a45815ebe71400308b5f655de5ad21b81019e856e"
    },
    {
      "path": "schemas/publication-record-0.1.0.schema.json",
      "sha256": "2d923795d123b54b877b33028e5d61a63bccbfa116ce2fd391c3f8cef23989f7"
    },
    {
      "path": "tools/build-frozen-publication-record.cjs",
      "sha256": "633d18cca9b4e35208be47ffcff1dbe46ae7ee904b880a77877dd885955dca8d"
    },
    {
      "path": "tools/build-publication-record.cjs",
      "sha256": "91a11fb1fdecb33871f189ddfb2f35648c8ba42372d19fdb94e9d492b3901f34"
    },
    {
      "path": "tools/check-corpus.cjs",
      "sha256": "8271b1f805e65a645f8c3846b89c008ed99a897aaa8ce221679690fb2fc7e5d7"
    },
    {
      "path": "tools/test-contract.cjs",
      "sha256": "bdcb32dfb34b34355d5e61d4ddfe0a98614c4844e1358f0fbf6b0be1138495f3"
    },
    {
      "path": "tools/validator.cjs",
      "sha256": "69c36ae38b1065b3d6700aec62955682e4b48ff5c9bc0eb274311e4428b0240f"
    }
  ],
  "gates": {
    "contract.gate.1": "PASS",
    "contract.gate.2": "PASS",
    "contract.gate.3": "PASS_18_TESTS_17_FIXTURES_4_EXAMPLES",
    "contract.gate.4": "PASS_EN_ZH_PARITY",
    "contract.gate.5": "PASS_RC_TAG_AND_8_ASSET_MANIFEST",
    "contract.gate.6": "PASS_2_FINAL_SEMANTIC_35_MACHINE_ARTIFACT_BINDING",
    "owner_approval": "https://github.com/firestige/workflow-self-recursive/issues/50#issuecomment-5427870271"
  }
}
